{
  "action_contract_id": "robot.tank.pick",
  "analysis": {
    "continuous_collision_status": "not-computed",
    "motion_corridor_status": "not-computed",
    "reason_codes": [
      "candidate-partial-corridor-not-bound-by-certificate-v0",
      "collision-scene-simulation-proxy-only",
      "continuous-collision-not-computed",
      "controller-interpolation-unresolved",
      "dynamic-world-not-registered-to-proxy-scene",
      "stop-model-missing"
    ],
    "recovery_envelope_status": "unknown",
    "result": "unknown",
    "stop_envelope_status": "unknown"
  },
  "certificate_digest": "029455204652079e9a963097232c56d522f75a36c85e505b54a2f9b02a414ee1",
  "certificate_id": "spatial-cert:69389a0e72c84e3b3c05ca1dfffded8a3dbf5bb24af8b95f5c242c2204237c54",
  "input_digests": {
    "collision_scene": "8bfd383e7215823beedf10d5e555e1b71bdaf7a9b61d4468c48e460357510d80",
    "motion_contract": "e5879b0efd2f194a127919f31e645ba3fedc2d58321c3dc991d13a24f73ce4fc",
    "test_lock": "2d57b1f27e6713a41ad41abe2fcec7b46dfeb3c99523b4ed191043cd0abbda33"
  },
  "mode": "shadow",
  "qualification": "candidate",
  "sample_id": "eit-ptlc-historical-v1",
  "schema": "lab.spatial-occupancy-certificate/v0"
}
